"Item type","Authors","Title","Publication year","Publisher","Date published","Date accessed","URLs","DOI","Abstract","Keywords","Notes","Status","Series"
"Conference Paper","Evgeny Stemasov (Institute of Media Informatics UU,Tobias Wagner (Institute of Media Informatics UU,Jan Gugenheimer (Télécom Paris - LTCI IP,Enrico Rukzio (Institute of Media Informatics UU","ShapeFindAR: Exploring In-Situ Spatial Search for Physical Artifact Retrieval using Mixed Reality","2022","","2022","","http://dx.doi.org/10.1145/3491102.3517682","10.1145/3491102.3517682","Personal fabrication is made more accessible through repositories like Thingiverse, as they replace modeling with retrieval. However, they require users to translate spatial requirements to keywords, which paints an incomplete picture of physical artifacts: proportions or morphology are non-trivially encoded through text only. We explore a vision of in-situ spatial search for (future) physical artifacts, and present ShapeFindAR, a mixed-reality tool to search for 3D-models using in-situ sketches blended with textual queries. With ShapeFindAR, users search for geometry, and not necessarily precise labels, while coupling the search process to the physical environment (e.g., by sketching in-situ, extracting search terms from objects present, or tracing them). We developed ShapeFindAR for HoloLens 2, connected to a database of 3D-printable artifacts. We specify in-situ spatial search, describe its advantages, and present walkthroughs using ShapeFindAR, which highlight novel ways for users to articulate their wishes, without requiring complex modeling tools or profound domain knowledge.","Full Paper","","published",""
"Conference Paper","Munich) JL,Munich) FF,Group) SC,Munich) AB","Towards Balancing Real-World Awareness and VR Immersion in Mobile VR","2022","","2022","","http://dx.doi.org/10.1145/3491101.3519824","10.1145/3491101.3519824","Virtual Reality (VR) can be used to create immersive infotainment experiences for car passengers. However, not much is known about how to best incorporate the essentials of their surroundings for balancing real-world awareness and immersion. To address this gap, we explored 2D and 3D visual cues of the rear-seat space to notify passengers about different real-world tasks (lower armrest, take cup, close window, and hold handle) during a first-person game in VR. Results from our pilot study (n=19) show that users perceive a lower workload in the task hold handle than all other tasks. They also feel more immersed in VR after completing this task, compared to take cup and close window. Based on our findings, we propose real-world task types, synchronous visual cues, and various input and transition approaches as promising future research directions.","Late Breaking Work","","published",""
"Conference Paper","of Stuttgart) AS,of Stuttgart) NH,of Stuttgart) NB,of Stuttgart) VB,of Stuttgart) MS","cARdLearner: Using Expressive Virtual Agents when Learning Vocabulary in Augmented Reality","2022","","2022","2022-04-30","http://dx.doi.org/10.1145/3491101.3519631","10.1145/3491101.3519631","Augmented reality (AR) has a diverse range of applications, including language teaching. When studying a foreign language, one of the biggest challenges learners face is memorizing new vocabulary. While augmented holograms are a promising means of supporting this memorization process, few studies have explored their potential in the language learning context. We demonstrate the possibility of using flashcard along with an expressive holographic agent on vocabulary learning. Users scan a flashcard and play an animation that is connected with an emotion related to the word they are seeing. Our goal is to propose an alternative to the traditional use of flashcards, and also introduce another way of using AR in the association process.","Late Breaking Work","","published",""
"Conference Paper","Natalie Hube (Mercedes-Benz AG Uof,Kresimir Vidackovic (Hochschule der Medien Uof,of Stuttgart) MS","Using Expressive Avatars to Increase Emotion Recognition: A Pilot Study","2022","","2022","","http://dx.doi.org/10.1145/3491101.3519822","10.1145/3491101.3519822","Virtual avatars are widely used for collaborating in virtual environments. Yet, often these avatars lack expressiveness to determine a state of mind. Prior work has demonstrated effective usage of determining emotions and animated lip movement through analyzing mere audio tracks of spoken words. To provide this information on a virtual avatar, we created a natural audio data set consisting of 17 audio files from which we then extracted the underlying emotion and lip movement. To conduct a pilot study, we developed a prototypical system that displays the extracted visual parameters and then maps them on a virtual avatar while playing the corresponding audio file. We tested the system with 5 participants in two conditions: (i) while seeing the virtual avatar only an audio file was played and (ii). In addition to the audio file, the extracted facial visual parameters were displayed on the virtual avatar. Our results suggest the validity of using additional visual parameters in the avatars' face as it helps to determine emotions. We conclude with a brief discussion on the outcomes and their implications on future work.","Late Breaking Work","","published",""
"Conference Paper","of Darmstadt) AM,Munich) FM,of Darmstadt) DS,of Darmstadt) RF,of Darmstadt) SA,of Darmstadt) YL,of Darmstadt) MM","E-ScootAR: Exploring Unimodal Warnings for E-Scooter Riders in Augmented Reality","2022","","2022","","http://dx.doi.org/10.1145/3491101.3519831","10.1145/3491101.3519831","Micro-mobility is becoming a more popular means of transportation. However, this increased popularity brings its challenges. In particular, the accident rates for E-Scooter riders increase, which endangers the riders and other road users. In this paper, we explore the idea of augmenting E-Scooters with unimodal warnings to prevent collisions with other road users, which include Augmented Reality (AR) notifications, vibrotactile feedback on the handlebar, and auditory signals in the AR glasses. We conducted an outdoor experiment (N = 13) using an Augmented Reality simulation and compared these types of warnings in terms of reaction time, accident rate, and feeling of safety. Our results indicate that AR and auditory warnings lead to shorter reaction times, have a better perception, and create a better feeling of safety than vibrotactile warnings. Moreover, auditory signals have a higher acceptance by the riders compared to the other two types of warnings.","Late Breaking Work","","published",""
"Conference Paper","of Darmstadt) AM,Munich) FM,of Darmstadt) DS,of Darmstadt) PS,of Darmstadt) SG,of Darmstadt) MM","BikeAR: Understanding Cyclists’ Crossing Decision-Making at Uncontrolled Intersections using Augmented Reality","2022","","2022","","http://dx.doi.org/10.1145/3491102.3517560","10.1145/3491102.3517560","Cycling has become increasingly popular as a means of transportation. However, cyclists remain a highly vulnerable group of road users. According to accident reports, one of the most dangerous situations for cyclists are uncontrolled intersections, where cars approach from both directions. To address this issue and assist cyclists in crossing decision-making at uncontrolled intersections, we designed two visualizations that: (1) highlight occluded cars through an X-ray vision and (2) depict the remaining time the intersection is safe to cross via a Countdown. To investigate the efficiency of these visualizations, we proposed an Augmented Reality simulation as a novel evaluation method, in which the above visualizations are represented as AR, and conducted a controlled experiment with 24 participants indoors. We found that the X-ray ensures a fast selection of shorter gaps between cars, while the Countdown facilitates a feeling of safety and provides a better intersection overview.","Full Paper","","published",""
"Conference Paper","of Darmstadt) AM,Munich) FM,of Darmstadt) MZ,of Darmstadt) LG,of Darmstadt) JA,of Darmstadt) TS,of Darmstadt) MM","Reducing Virtual Reality Sickness for Cyclists in VR Bicycle Simulators","2022","","2022","","http://dx.doi.org/10.1145/3491102.3501959","10.1145/3491102.3501959","Virtual Reality (VR) bicycle simulations aim to recreate the feeling of riding a bicycle and are commonly used in many application areas. However, current solutions still create mismatches between the visuals and physical movement, which causes VR sickness and diminishes the cycling experience. To reduce VR sickness in bicycle simulators, we conducted two controlled lab experiments addressing two main causes of VR sickness: (1) steering methods and (2) cycling trajectory. In the first experiment (N = 18) we compared handlebar, HMD, and upper-body steering methods. In the second experiment (N = 24) we explored three types of movement in VR (1D, 2D, and 3D trajectories) and three countermeasures (airflow, vibration, and dynamic Field-of-View) to reduce VR sickness. We found that handlebar steering leads to the lowest VR sickness without decreasing cycling performance and airflow suggests to be the most promising method to reduce VR sickness for all three types of trajectories.","Full Paper","","published",""
"Conference Paper","of Darmstadt) AM,Munich) FM,of Darmstadt) MS,of Darmstadt) MF,of Darmstadt) MM","SkyPort: Investigating 3D Teleportation Methods in Virtual Environments","2022","","2022","2022-04-30","http://dx.doi.org/10.1145/3491102.3501983","10.1145/3491102.3501983","Teleportation has become the de facto standard of locomotion in Virtual Reality (VR) environments. However, teleportation with parabolic and linear target aiming methods is restricted to horizontal 2D planes and it is unknown how they transfer to the 3D space. In this paper, we propose six 3D teleportation methods in virtual environments based on the combination of two existing aiming methods (linear and parabolic) and three types of transitioning to a target (instant, interpolated and continuous). To investigate the performance of the proposed teleportation methods, we conducted a controlled lab experiment (N = 24) with a mid-air coin collection task to assess accuracy, efficiency and VR sickness. We discovered that the linear aiming method leads to faster and more accurate target selection. Moreover, a combination of linear aiming and instant transitioning leads to the highest efficiency and accuracy without increasing VR sickness.","Full Paper, Honorable Mention","","published",""
"Conference Paper","of Bremen) FP,of Bremen) SP,of Bremen) MS,Institute) CM,Institute) ES","Understanding HCI Practices and Challenges of Experiment Reporting with Brain Signals: Towards Reproducibility and Reuse","2022","","2022","","http://dx.doi.org/10.1145/3490554","10.1145/3490554","In HCI, there has been a push towards open science, but to date, this has not happened consistently for HCI research utilizing brain signals due to unclear guidelines to support reuse and reproduction. To understand existing practices in the field, this paper examines 110 publications, exploring domains, applications, modalities, mental states and processes, and more. This analysis reveals variance in how authors report experiments, which creates challenges to understand, reproduce, and build on that research. It then describes an overarching experiment model that provides a formal structure for reporting HCI research with brain signals, including definitions, terminology, categories, and examples for each aspect. Multiple distinct reporting styles were identified through factor analysis and tied to different types of research. The paper concludes with recommendations and discusses future challenges. This creates actionable items from the abstract model and empirical observations to make HCI research with brain signals more reproducible and reusable.","Journal","","published",""
"Conference Paper","of Glasgow) KM,Munich) AK,Schallkultur) AW,Munich) JK,Munich) MH,of Technology) PW,Darmstadt) MM,University) TK","Intelligent Music Interfaces: When Interactive Assistance and Augmentation Meet Musical Instruments","2022","","2022","","http://dx.doi.org/10.1145/3491101.3503743","10.1145/3491101.3503743","The interactive augmentation of musical instruments to foster self-expressiveness and learning has a rich history. Over the past decades, the incorporation of interactive technologies into musical instruments emerged into a new research field requiring strong collaboration between different disciplines. The workshop ""Intelligent Music Interfaces"" consequently covers a wide range of musical research subjects and directions, including (a) current challenges in musical learning, (b) prototyping for improvements, (c) new means of musical expression, and (d) evaluation of the solutions.","Workshop","","published",""
"Conference Paper","Tuk) DQ,Iannis Albert (Technische Universität Kaiserslautern TUK Uof,Tuk) PZ,Tuk) NB,Georg Volkmar (Digital Media Lab Uof,Bastian Dänekas (Digital Media Lab Uof,Rainer Malaka (Digital Media Lab Uof,Marc Herrlich (Technische Universität Kaiserslautern TUK D","SpiderClip: Towards an Open Source System for Wearable Device Simulation in Virtual Reality","2022","","2022","2022-04-30","http://dx.doi.org/10.1145/3491101.3519758","10.1145/3491101.3519758","Smartwatches and fitness trackers integrate different sensors from inertial measurement units to heart rate sensors in a very compact and affordable form factor. This makes them interesting and relevant research tools. One potential application domain is virtual reality, e.g., for health related applications such as exergames or simulation approaches. However, commercial devices complicate and limit the collection of raw and real-time data, suffer from privacy issues and are not tailored to using them with VR tracking systems. We address these issues with an open source design to facilitate the construction of VR-enabled wearables for conducting scientific experiments. Our work is motivated by research in mixed realities in pervasive computing environments. We introduce our system and present a proof-of-concept study with 17 participants. Our results show that the wearable reliably measures high-quality data comparable to commercially available fitness trackers and that it does not impede movements or interfere with VR tracking.","Late Breaking Work","","published",""
"Conference Paper","Siegen) FA,Siegen) AM,Siegen) AU,Siegen) GS","On Appropriation and Nostalgic Reminiscence of Technology","2022","","2022","","http://dx.doi.org/10.1145/3491101.3519676","10.1145/3491101.3519676","Technological objects present themselves as necessary, only to become obsolete faster than ever before. This phenomenon has led to a population that experiences a plethora of technological objects and interfaces as they age, which become associated with certain stages of life and disappear thereafter. Noting the expanding body of literature within HCI about appropriation, our work pinpoints an area that needs more attention, “outdated technologies.” In other words, we assert that design practices can profit as much from imaginaries of the future as they can from reassessing artefacts from the past in a critical way. In a two-week fieldwork with 37 HCI students, we gathered an international collection of nostalgic devices from 14 different countries to investigate what memories people still have of older technologies and the ways in which these memories reveal normative and accidental use of technological objects. We found that participants primarily remembered older technologies with positive connotations and shared memories of how they had adapted and appropriated these technologies, rather than normative uses. We refer to this phenomenon as nostalgic reminiscence. In the future, we would like to develop this concept further by discussing how nostalgic reminiscence can be operationalized to stimulate speculative design in the present.","Late Breaking Work","","published",""
"Conference Paper","Siegen) VK,of Michigan) MN,Siegen) FJ,Alexander Boden (Hochschule Bonn-Rhein-Sieg FF","Elements of XR Prototyping: Characterizing the Role and Use of Prototypes in Augmented and Virtual Reality Design","2022","","2022","","http://dx.doi.org/10.1145/3491102.3517714","10.1145/3491102.3517714","Current research in augmented, virtual, and mixed reality (XR) reveals a lack of tool support for designing and, in particular, prototyping XR applications. While recent tools research is often motivated by studying the requirements of non-technical designers and end-user developers, the perspective of industry practitioners is less well understood. In an interview study with 17 practitioners from different industry sectors working on professional XR projects, we establish the design practices in industry, from early project stages to the final product. To better understand XR design challenges, we characterize the different methods and tools used for prototyping and describe the role and use of key prototypes in the different projects. We extract common elements of XR prototyping, elaborating on the tools and materials used for prototyping and establishing different views on the notion of fidelity. Finally, we highlight key issues for future XR tools research.","Full Paper","","published",""
"Conference Paper","Munich) ST,Munich) RS,Munich) LK,Munich) SM","User Perceptions of Extraversion in Chatbots after Repeated Use","2022","","2022","","http://dx.doi.org/10.1145/3491102.3502058","10.1145/3491102.3502058","Whilst imbuing robots and voice assistants with personality has been found to positively impact user experience, little is known about user perceptions of personality in purely text-based chatbots. In a within-subjects study, we asked N=34 participants to interact with three chatbots with different levels of Extraversion (extraverted, average, introverted), each over the course of four days. We systematically varied the chatbots' responses to manipulate Extraversion based on work in the psycholinguistics of human behaviour. Our results show that participants perceived the extraverted and average chatbots as such, whereas verbal cues transferred from human behaviour were insufficient to create an introverted chatbot. Whilst most participants preferred interacting with the extraverted chatbot, participants engaged significantly more with the introverted chatbot as indicated by the users' average number of written words. We discuss implications for researchers and practitioners on how to design chatbot personalities that can adapt to user preferences.","Full Paper","","published",""
"Conference Paper","Nima Zargham (Digital Media Lab Uof,Dmitry Alexandrovsky (Digital Media Lab Uof,Jan Erich (Digital Media Lab Uof,Nina Wenig (Digital Media Lab Uof,Rainer Malaka (Digital Media Lab Uof","""I Want It That Way"": Exploring Users' Customization and Personalization Preferences for Home Assistants","2022","","2022","","http://dx.doi.org/10.1145/3491101.3519843","10.1145/3491101.3519843","Home assistants are becoming a widespread product, but they mostly come as a compact device and offer very few customization and personalization features, which often leads to dissatisfaction. With the technological advancements, these systems are becoming more adaptable to the users' needs and can better imitate a human personality. To achieve that efficiently, understanding how different users envision their desired assistant is crucial. To identify people's customization and personalization preferences and their desired personality for a home assistant, we designed a set of storyboards depicting a variety of possible features in a domestic setting and conducted a user study (N=15), including a series of semi-structured interviews. Our quantitative results suggest that users prefer an agent which is highly agreeable and has higher conscientiousness and emotional stability. Furthermore, we discuss users' customization and personalization preferences for a home assistant, which could be considered when designing the future generation of home assistants.","Late Breaking Work","","published",""
"Conference Paper","Nima Zargham (Digital Media Lab Uof,Johannes Pfau (Digital Media Lab Uof,Tobias Schnackenberg (Digital Media Lab Uof,Rainer Malaka (Digital Media Lab Uof","""I Didn't Catch That, But I'll Try My Best'': Anticipatory Error Handling in a Voice Controlled Game","2022","","2022","2022-04-30","http://dx.doi.org/10.1145/3491102.3502115","10.1145/3491102.3502115","Advances in speech recognition, language processing and natural interaction have led to an increased industrial and academic interest. While the robustness and usability of such systems are steadily increasing, speech-based systems are still susceptible to recognition errors. This makes intelligent error handling of utmost importance for the success of those systems. In this work, we integrated anticipatory error handling for a voice-controlled video game where the game would perform a locally optimized action in respect to goal completion and obstacle avoidance, when a command is not recognized. We evaluated the user experience of our approach versus traditional, repetition-based error handling (N=34). Our results indicate that implementing anticipatory error handling can improve the usability of a system, if it follows the intention of the user. Otherwise, it impairs the user experience, even when deciding for technically optimal decisions.","Full Paper","","published",""
"Conference Paper","Munich) PE,Ms. Mennatallah Saleh (Hamm-Lippstadt University of Applied Science TU,of Applied Sciences) CS,Munich) AS","How do Users Expect their Smart Memory Vaults to Utilize Their Shared Memories?","2022","","2022","","","","Social media (SM) is a popular accessible form of smart memory vaults. Prior work shows that users are still unable to understand how their shared memories are used by smart systems to create Smart Interactions involving Personal Memories (SIPMs). This can lead to negative social repercussions such as cyberbullying. This work investigates the most memorable SIPMs on Facebook for Egyptian users and their impact on platform usage. We conducted an online survey (N=53) requesting critical incident reports about surprising Facebook SIPMs. The most remembered SIPMs were: customizing advertisements, cuing offline interactions, sharing data with third parties and personalizing the newsfeed. Our results suggest that SIPMs, particularly customized advertisements act as ambient memory augmentation solutions to the users’ shared memories. Additionally, negative platform perception does not necessarily translate into reduction of platform usage. Our work inspires the discussion about users expectations towards ambient usage of their data on smart memory vaults.","Late Breaking Work","","published",""
"Conference Paper","University) VK,Michoacana) CR,of Cincinnati) AS,University) RA,(IIIT-Delhi) AT,of Technology) DG,University) FN,of Washington) NK,of Virginia) DN,of Colorado Boulder) Duniversity,& Associates) SD,of Applied Sciences) CS,Tech) NK","HCI Across Borders: Navigating the shifting borders in CHI","2022","","2022","","","","HCI research has led to major innovations used by large and diverse audiences in different parts of the world. However, a recent meta-analysis found that research at CHI is still highly (73%) concentrated in western contexts. HCI Across Borders (HCIxB) has gathered a diverse audience to expand the borders within CHI over the past six years. For CHI 2022, we expect to regroup to reflect on shifting boundaries from CHI’s past and emerging challenges in research, teaching, and practice during the Covid-19 pandemic.","Workshop","","published",""
"Conference Paper","of Bremen) TM,of Bremen) MB,of Bremen) AV,of Bremen) RM,of Bremen) TD","Haptic Fidelity Framework: Defining the Factors of Realistic Haptic Feedback for Virtual Reality","2022","","2022","2022-04-30","http://dx.doi.org/10.1145/3491102.3501953","10.1145/3491102.3501953","Providing haptic feedback in virtual reality to make the experience more realistic has become a strong focus of research in recent years. The resulting haptic feedback systems differ greatly in their technologies, feedback possibilities, and overall realism making it challenging to compare different systems. We propose the Haptic Fidelity Framework providing the means to describe, understand and compare haptic feedback systems. The framework locates a system in the spectrum of providing realistic or abstract haptic feedback using the Haptic Fidelity dimension. It comprises 14 criteria that either describe foundational or limiting factors. A second Versatility dimension captures the current trade-off between highly realistic but application-specific and more abstract but widely applicable feedback. To validate the framework, we compared the Haptic Fidelity score to the perceived feedback realism of evaluations from 38 papers and found a strong correlation suggesting the framework accurately describes the realism of haptic feedback.","Full Paper","","published",""
